{"base_site":{"path":"/srv/sparkinterval-operator/site/azure-cpu-materializer-site.json","sha256":"0000000000000000000000000000000000000000000000000000000000000000","size_bytes":0},"hurst":{"boost_include_root":"/srv/sparkinterval-source/boost-1.83.0","hurst_source_root":"/srv/sparkinterval-source/hurst-mertens","predecessor_exports":[]},"kind":"sparkinterval.azure.cpu.hurst-portfolio-materializer-site.v1","schema_version":1}
